{
  "event_id": "550e8400-e29b-41d4-a716-446655440002",
  "correlation_id": "550e8400-e29b-41d4-a716-446655440000",
  "tenant_id": "tenant_acme_corp",
  "occurred_at": "2024-01-15T14:35:00.000Z",
  "event_type": "business.invoice.issued",
  "version": "1.0.0",
  "source": "contabilium",
  "payload": {
    "invoice_id": "INV-CTB-789012",
    "invoice_number": "0003-00012345",
    "invoice_type": "B",
    "invoice_date": "2024-01-15",
    "due_date": "2024-02-15",
    "related_order_id": "MP-12345678901",
    "related_payment_id": "PAY-98765432109",
    "subtotal": 12396.69,
    "tax_amount": 2603.31,
    "total_amount": 15000.00,
    "currency": "ARS",
    "customer": {
      "id": "CTB-CUST-456",
      "name": "Juan Pérez",
      "email": "juan.perez@example.com",
      "identification": {
        "type": "DNI",
        "number": "30123456"
      },
      "tax_category": "consumidor_final",
      "address": {
        "street": "Av. Corrientes 1234",
        "city": "Buenos Aires",
        "state": "CABA",
        "zip_code": "C1043AAZ",
        "country": "AR"
      }
    },
    "issuer": {
      "cuit": "30123456789",
      "business_name": "ACME Corp S.R.L.",
      "point_of_sale": 3,
      "tax_category": "responsable_inscripto"
    },
    "items": [
      {
        "id": "LINE-001",
        "sku": "SKU-WIDGET-001",
        "description": "Widget Premium",
        "quantity": 2,
        "unit": "unidad",
        "unit_price": 4958.68,
        "tax_rate": 21,
        "subtotal": 9917.36
      },
      {
        "id": "LINE-002",
        "sku": "SKU-GADGET-002",
        "description": "Gadget Básico",
        "quantity": 1,
        "unit": "unidad",
        "unit_price": 2479.34,
        "tax_rate": 21,
        "subtotal": 2479.34
      }
    ],
    "taxes": [
      {
        "tax_type": "iva",
        "tax_id": "5",
        "rate": 21,
        "base_amount": 12396.69,
        "amount": 2603.31
      }
    ],
    "afip": {
      "cae": "74123456789012",
      "cae_expiration": "2024-01-25",
      "authorization_date": "2024-01-15T14:34:55.000Z"
    },
    "pdf_url": "https://api.contabilium.com/invoices/INV-CTB-789012/pdf",
    "metadata": {
      "erp_batch_id": "BATCH-2024-01-15-001"
    }
  }
}
